{
  "$schema": "http://json-schema.org/draft-07/schema#",
  "$id": "https://contracts.yomp.dog/place.schema.json",
  "title": "Place",
  "description": "A discoverable venue as the apps render it — the shape carried by /api/places, the L1/L2 caches and the map/bottom-sheet surfaces. AUTHORED FROM yomp-next/src/types/place.ts (verified against a533bfc): field-for-field, same names, same types, same optionality. This schema DOCUMENTS the shape that already exists; it does not redesign it, and no field may be added, renamed or dropped here without the same change landing in place.ts. NOTE: `dogStatus` is the RESOLVED place-status vocabulary (yes|no|unknown), which is NOT the community-VOTE vocabulary STATUS (yes|no|check) in community.json — see the DOG_STATUS constant. The two are intentionally distinct and must never be merged. The dogStatus enum here is build-guarded to equal community.json's dogStatus exactly. Source of truth for yomp-next (TS), yomp-android (Kotlin) and a future iOS client. TYPE NOTES: TS is emitted with --prefer-unions so every enum below becomes a string union identical to place.ts; Kotlin post-processes those enums to plain String, per the same principle as account.json's key lists (an out-of-vocabulary wire value must be filterable on read, never a deserialisation crash). Counter fields are `integer` so Kotlin gets Long, matching PlaceStats.ratingCount.",
  "type": "object",
  "properties": {
    "id": {
      "type": "string",
      "description": "Provider place id as discovery returned it (Google Places id, DataForSEO id, or an `osm_`-prefixed seed id). Raw, NOT the safeId form — callers sanitise with safeId() when deriving a Firestore doc id."
    },
    "name": {
      "type": "string",
      "description": "Venue display name."
    },
    "lat": {
      "type": "number",
      "description": "Venue latitude, WGS84 decimal degrees."
    },
    "lng": {
      "type": "number",
      "description": "Venue longitude, WGS84 decimal degrees."
    },
    "type": {
      "type": "string",
      "description": "Raw provider primary-type string exactly as discovery returned it (Google Places New primaryType, or the DataForSEO type) - e.g. 'bar', 'park'. Open vocabulary; 'unknown' when absent. NOT a Yomp CategoryKey: consumers collapse this to a category at read time via getCategoryFromType()."
    },
    "dogStatus": {
      "type": "string",
      "enum": ["yes", "no", "unknown"],
      "description": "The RESOLVED dog-friendliness of this place, as rendered. This is the DOG_STATUS vocabulary (yes|no|unknown), NOT the community-vote STATUS vocabulary (yes|no|check) - the two are intentionally distinct, do not merge them. Set by dogStatusResolver; see dogStatusSource for its provenance."
    },
    "rating": {
      "type": "number",
      "description": "Google Places star rating (1-5). NOT the Yomp community paw average (deriveAverageRating)."
    },
    "ratingCount": {
      "type": "integer",
      "description": "Number of Google Places ratings behind `rating`. NOT the Yomp community vote count."
    },
    "address": {
      "type": "string",
      "description": "Formatted street address."
    },
    "phone": {
      "type": "string",
      "description": "Contact telephone number as the provider returned it."
    },
    "website": {
      "type": "string",
      "description": "Venue website URL."
    },
    "openNow": {
      "type": "boolean",
      "description": "Whether the venue is open at the moment the payload was built. A snapshot, not a live value - stale once cached."
    },
    "todayHours": {
      "type": "string",
      "description": "Human-readable opening hours for the current day only. See weeklyHours for the full week."
    },
    "weeklyHours": {
      "type": "array",
      "items": { "type": "string" },
      "description": "Full 7-day opening hours mapped directly from DFSEO timetable. Array of human-readable strings, one per day, e.g. \"Monday: 9:00-17:00\". Populated by formatDfseoItem. Supplements todayHours without needing a Google Place Details call."
    },
    "mainImage": {
      "type": "string",
      "description": "Direct googleusercontent.com image URL returned by DFSEO main_image. Used as a fallback photo while Google Place Details enrichment loads. Not a Google Places photo resource name - cannot be used with the /api/place-photo proxy. Render as a plain <img src> only."
    },
    "photoNames": {
      "type": "array",
      "items": { "type": "string" },
      "description": "Google Places photo resource names, e.g. `places/ChIJ.../photos/AVz...`. Up to 3 names are kept per place to cap payload size and billable photo fetches. Use <PlacePhoto name={...} /> to render. Empty/missing means the caller should show the emoji+gradient fallback."
    },
    "editorialSummary": {
      "type": "string",
      "description": "Google Places editorial summary - a short description authored by Google."
    },
    "dogStatusSource": {
      "type": "string",
      "enum": ["owner", "community", "google", "dataforseo_keyword", "default"],
      "description": "Provenance of the dogStatus value above. Set by dogStatusResolver. Used by BottomSheet to caption the badge (\"Verified\" / \"12 dog owners\" / etc). Optional - older cached venues from before the resolver landed lack it."
    },
    "dogStatusConfidence": {
      "type": "string",
      "enum": ["high", "medium", "low"],
      "description": "Confidence label attached to the resolved dogStatus. A label only - it never changes the status itself."
    },
    "dogStatusVoteCount": {
      "type": "integer",
      "description": "Total community votes when dogStatusSource === 'community'."
    },
    "businessStatus": {
      "type": "string",
      "enum": ["OPERATIONAL", "CLOSED_TEMPORARILY", "CLOSED_PERMANENTLY"],
      "description": "Google businessStatus - written back from place-details enrichment."
    },
    "tier": {
      "type": "string",
      "enum": ["unclaimed", "claimed", "verified_basic", "verified_premium"],
      "description": "Ownership/verification tier. Drives the Verified Basic brass-pin treatment on the map. Ownership data (not Google enrichment - lives on Place, not PlaceEnrichment). Absent on uncached / legacy venues, which are treated as unclaimed. verified_premium renders identically to verified_basic for now."
    }
  },
  "required": ["id", "name", "lat", "lng", "type", "dogStatus"],
  "additionalProperties": false
}
